<?xml version="1.0" encoding="UTF-8"?>
<?xml-stylesheet type="text/xsl" href="present5.xsl"?>

<!-- kathe fora antikathistoyme to line2 me analoga me to xml poy theloyme na trexoume--> 

<!DOCTYPE Epipla_Diakosmisi_AE SYSTEM "HOME23_new.dtd">

<Epipla_Diakosmisi_AE number_of_products="over of 2.000" Year_opened="2004">
	<name>HOME23</name>
	<stores_list>
		<store strid="1" name="HOME23 - Αθήνα (Κολωνάκι)"></store>
		<store strid="2" name="HOME23 - Αθήνα (Αεροδρόμιο)"></store>
		<store strid="3" name="HOME23 - Θεσσαλονίκη"></store>
		<store strid="4" name="HOME23 - Ιωάννινα"></store>
		<store strid="5" name="HOME23 - Λάρισα"></store>
		<store strid="6" name="HOME23 - Ξάνθη"></store>
		<store strid="7" name="HOME23 - Κέρκυρα"></store>
		<store strid="8" name="HOME23 - Καλαμάτα"></store>
		<store strid="9" name="HOME23 - Κρήτη"></store>
	</stores_list>
	<product_categories> 
		
		<product_type prod_class_id="1">Καναπέδες και πολυθρόνες</product_type>
		<product_type prod_class_id="2">Έπιπλα οργάνωσης κι αποθήκευσης</product_type>
		<product_type prod_class_id="3">Κουζίνα και Πάγκοι Κουζίνας</product_type>
		<product_type prod_class_id="4">Είδη Σερβιρίσματος</product_type>
		<product_type prod_class_id="5">Χαλιά</product_type>
		<product_type prod_class_id="6">Κρεβάτια και Στρώματα και μαξιλάρια</product_type>
		<product_type prod_class_id="7">Ντουλάπες</product_type>
		<product_type prod_class_id="8">Βρεφικά -Παιδικά Είδη και έπιπλα</product_type>
		<product_type prod_class_id="9">Λευκά είδη</product_type>
		<product_type prod_class_id="10">Φωτισμός</product_type>
		<product_type prod_class_id="11">Γραφεία</product_type>
		<product_type prod_class_id="12">Συρταριέρες</product_type>
		<product_type prod_class_id="13">Τραπέζια</product_type>
		<product_type prod_class_id="14">Είδη Κουζίνας</product_type>
		<product_type prod_class_id="15">Σκαμπό και πάγκοι κουζίνας</product_type>
		<product_type prod_class_id="16">Κομοδίνα</product_type>
		<product_type prod_class_id="17">Καρέκλες</product_type>
		<product_type prod_class_id="18">Διακόσμηση Τοίχου και καθρέφτες</product_type>
		<product_type prod_class_id="19">Διακοσμητικά, κεριά και φυτά</product_type>
		<product_type prod_class_id="20">Κήπος και εξωτερικοί χώροι</product_type>
		<product_type prod_class_id="21">Είδη μπάνιου</product_type>
		<product_type prod_class_id="22">Μπουφέδες</product_type>
		<product_type prod_class_id="23">Εργαλεία και εξαρτήματα</product_type>
		<product_type prod_class_id="24">Χόμπι και ασφάλεια</product_type>
		<product_type prod_class_id="25">Κουρτίνες</product_type>
		<product_type prod_class_id="26">Ριχτάρια </product_type>     
	</product_categories>
	<room_classification value="">
		<room_class class_id="1">Υπνοδωμάτιο (bedroom)</room_class>
		<room_class class_id="2">Μπάνιο (bathroom)</room_class>
		<room_class class_id="3">Δωμάτιο Γραφείου (office)</room_class>
		<room_class class_id="4">Καθιστικό/Σαλόνι (living_room)</room_class>
		<room_class class_id="5">Τραπεζαρία (dining_room)</room_class>
		<room_class class_id="6">Κουζίνα (kitchen)</room_class>
		<room_class class_id="7">Παιδικό δωμάτιο (kids_room)</room_class>
		<room_class class_id="8">Εξωτερικοί Χώροι/Κήπος (outdoor) </room_class>
		<room_class class_id="9">Χώρος Αποθήκευσης (Αποθήκη)/Γκαράζ (storage_room)</room_class>
	</room_classification>
	<special_classification>
		<special_classes>
			<campaign spclass_id="1"></campaign>
			<outlet spclass_id="2"></outlet>
		</special_classes>
	</special_classification>
	<contact_details>
		<Headquarters>
			<address>Παπαρηγοπούλου 345, Αθήνα, ΕΛΛΑΔΑ, 100-45</address>
			<tel>+30 210 12345678</tel>
			<email>xyz@outl.HOME23.com</email>
		</Headquarters>
		<stores>
			<shop_store>
				<address>xyzw 99, Αθήνα,ΕΛΛΑΔΑ, 100-54</address>
				<tel>+30 210 213359778</tel>
				<email>kolonaki@outl.HOME23.com</email>
			</shop_store>
			<shop_store>
				<address>Ελ. Βενιζέλου 7, Παιανία,ΕΛΛΑΔΑ, 102-33</address>
				<tel>+30 210 133669785</tel>
				<email>airport@outl.HOME23.comm</email>
			</shop_store>
			<shop_store>
				<address> Τσιμισκί 200, Θεσσαλονίκη,ΕΛΛΑΔΑ, 456-32</address>
				<tel>+30 2310 999669321</tel>
				<email>Thessaloniki@outl.HOME23.com</email>
			</shop_store>
			<shop_store>
				<address>Σουλίου 67, Ιωάννινα,ΕΛΛΑΔΑ, 323-11</address>
				<tel>+30 26510-432990321</tel>
				<email>Ioannina@outl.HOME23.com</email>
			</shop_store>
			<shop_store>
				<address>Ασκληπιού 119, Λάρισα,ΕΛΛΑΔΑ, 412-22</address>
				<tel>+30 2410 241111</tel>
				<email>larissa@outl.HOME23.com</email>
			</shop_store>
			<shop_store>
				<address>Φιλελλήνων 10, Κέρκυρα,ΕΛΛΑΔΑ, 491-31</address>
				<tel>+30 26610 301158</tel>
				<email>kerkira@outl.HOME23.com</email>
			</shop_store>
			<shop_store>
				<address>Αριστομένους 115, Καλαμάτα,ΕΛΛΑΔΑ, 241-00</address>
				<tel>+30 27210-97967</tel>
				<email>kalamata@outl.HOME23.com</email>
			</shop_store>
			<shop_store>
				<address>Λεωφ. Κνωσού 13, Ηράκλειο,ΕΛΛΑΔΑ, 714-10</address>
				<tel>+30 2810-211111</tel>
				<email>creta@outl.HOME23.com</email>
			</shop_store>
		</stores>
	</contact_details>
	<store_hours>
		<Day day_id="1">Δευτέρα
			<Timing>9:00 am - 15:00 pm</Timing>
		</Day>
		<Day day_id="2">Τρίτη		
			<Timing>9:00 am - 15:00 pm και 17:00 pm - 21:00 pm</Timing>
		</Day>
		<Day day_id="3">Τετάρτη
			<Timing>9:00 am - 15:00 pm</Timing>
		</Day>
		<Day day_id="4">Πέμπτη		
			<Timing>9:00 am - 15:00 pm και 17:00 pm - 21:00 pm</Timing>
		</Day>
		<Day day_id="5">Παρακσευή		
			<Timing>9:00 am - 21:00 pm</Timing>
		</Day>
		<Day day_id="6">Σάββατο		
			<Timing>9:00 am - 18:00 pm</Timing>
		</Day>
		<Day day_id="7">Κυριακή		
			<Timing>Κλειστά</Timing>
		</Day>
	</store_hours>
	<Services>
		<shipping_Charges>
			<charges_Ath_Th shipping_until="4 εργάσιμων ημερών" >
				<shipValue ship_weight_category="0 - 15 κιλά" shpunit="euro">4.50</shipValue>
				<shipValue ship_weight_category="15.01 - 35 κιλά" shpunit="euro">9.00</shipValue>
				<shipValue ship_weight_category="35.01 - 65 κιλά" shpunit="euro">19.00</shipValue>
				<shipValue ship_weight_category="65.01 - 100 κιλά" shpunit="euro">29.00</shipValue>
				<shipValue ship_weight_category="100.01 - 200 κιλά" shpunit="euro">49.00</shipValue>
				<shipValue ship_weight_category="200.01 - 400 κιλά" shpunit="euro">59.00</shipValue>
				<shipValue ship_weight_category="> 400.01 κιλά" shpunit="euro">69.00</shipValue>
			</charges_Ath_Th>
			<charges_other_places shipping_until="8 εργάσιμων ημερών">
				<shipValue ship_weight_category="0 - 15 κιλά" shpunit="euro">7.50</shipValue>
				<shipValue ship_weight_category="15.01 - 35 κιλά" shpunit="euro">11.50</shipValue>
				<shipValue ship_weight_category="35.01 - 65 κιλά" shpunit="euro">33.00</shipValue>
				<shipValue ship_weight_category="65.01 - 100 κιλά" shpunit="euro">58.00</shipValue>
				<shipValue ship_weight_category="100.01 - 200 κιλά" shpunit="euro">78.00</shipValue>
				<shipValue ship_weight_category="200.01 - 400 κιλά" shpunit="euro">95.00</shipValue>
				<shipValue ship_weight_category="> 400.01 κιλά" shpunit="euro">105.00</shipValue>
			</charges_other_places>
		</shipping_Charges>
		<Assembly_Charges>
			<assValue assunit="euro" ass_category="Προϊόντα αξίας από  0.01 - 2.500 ευρώ:">10% της αξίας του προϊόντος που θέλετε να συναρμολογήσετε</assValue> 
			<assValue ass_category="Προϊόντα αξίας > 2.500 Ευρώ:">δωρεάν</assValue>
		</Assembly_Charges>
		<Interior_Design_Charges>
			<DesValue forevery="δωμάτιο"  Des_category="&lt; 50m2" dessunit="euro">200</DesValue>
			<DesValue forevery="δωμάτιο" Des_category=">=50m2">300</DesValue>
		</Interior_Design_Charges>
	</Services>
	<product_list>
		<product product_id="1" prod_class_id="21 9" room_class="2" spclass_id="2">
			<product_identification product_code="H28K4741L" product_name="Μπουρνούζι LERUM"/>
			<store_availability>
				<quantity store_id="3">10</quantity>	
				<quantity store_id="2">2</quantity>
			</store_availability>
			<product_descr>
			Πολύ απαλό και απορροφητικό μπουρνούζι, υφασμένο από 100% βαμβάκι και σε μοναδικές αποχρώσεις που ταιριάζουν και κολακεύουν τον καθένα.
			Μοναδικής ποιότητας μπουρνούζι με κουκούλα, διαθέσιμο σε 10 αποχρώσεις.
			</product_descr>
			<product_characteristics>
				<manufacturer_country>Ελλάδα</manufacturer_country>
				<weight unit_weight="gr">480</weight>
				<material mtr="1">100% Βαμβάκι</material>
				<color>Γκρι</color>
				<size>L</size>
				<size>XL</size>
				<certified certificate="STANDARD 100 by OEKO-TEX®"></certified>
			</product_characteristics>
			<start_value valunit="euro" can_return="no">19.99
				<offer_rate>33%</offer_rate>
			</start_value>
			<Final_value fnlunit="euro">13.50</Final_value>
		</product>
		<product product_id="2" prod_class_id="11" room_class="3">
			<product_identification product_code="K33J4755J" product_name="Γραφείο DERUP 40x100 λευκό"/>
			<store_availability>
				<quantity store_id="3">3</quantity>
				<quantity store_id="1">2</quantity>
				<quantity store_id="4">1</quantity>
				<quantity store_id="5">3</quantity>
				<quantity store_id="8">2</quantity>
				<quantity store_id="9">2</quantity>
			</store_availability>
			<product_descr>Η σειρά εργασιακών γραφείων DERUP, είναι ο απόλυτος συνδυασμός απαλών φορμών, φυσικών υλικών και χρωμάτων,
			για ένα φιλικό προς τον χρήστη εργασιακό περιβάλλον.Καλύπτει άψογα πολλές τις ανάγκες των χώρων εργασίας,
			αναδεικνύοντας τον χώρο με τον αυθεντικό αλλά ταυτόχρονα και εντυπωσιακό σχεδιασμό της.</product_descr>
			<product_characteristics>
				<manufacturer_country>Ελλάδα</manufacturer_country>
				<weight unit_weight="kg">15</weight>
				<material mtr="1">Μελαμίνη</material>
				<material mtr="2">Μοριοσανίδα</material>
				<material mtr="3">HDF</material>
				<material mtr="4">Πλαστικό</material>
				<included quantity="1">Συρτάρι</included>
				<included quantity="1">Φρένο Συρταριού</included>
				<color>Λευκό</color>
				<Dimensions assembled_boolean="true">
					<height unit_height="cm">75</height>